Customer Name,Email,Last Order Date,Total Order Value,Last 3 Items Ordered,
Michael Curry,udit.jain+MIStest@solarsales.in,13/05/25,162767,"Vanilla Frappe, Cola Base, Green Apple Syrup",
Dwayne Cook,udit.jain+MIStest@solarsales.in,15/03/25,66269,"Strawberry Crush, Vanilla Frappe, Mango Crush",
Denise Walker,udit.jain+MIStest@solarsales.in,07-04-25,248495,"Mango Crush, Blueberry Syrup, Vanilla Frappe",
Arthur Myers,udit.jain+MIStest@solarsales.in,15/02/25,112054,"Green Apple Syrup, Lemon Juice, Kiwi Crush",
Hannah Armstrong,udit.jain+MIStest@solarsales.in,02-06-25,201673,"Kiwi Crush, Lemon Juice, Orange Crush",
Phyllis Roberts,udit.jain+MIStest@solarsales.in,04-02-25,216918,"Choco Sauce, Chocolate Frappe, Mango Crush",
Victor Mercer,udit.jain+MIStest@solarsales.in,25/01/25,70335,"Cola Base, Strawberry Crush, Orange Crush",
Cody Romero,udit.jain+MIStest@solarsales.in,25/03/25,123461,"Watermelon Syrup, Lemon Juice, Green Apple Syrup",
Michelle Rodriguez,udit.jain+MIStest@solarsales.in,30/01/25,68555,"Orange Crush, Lemon Juice, Mint Mojito",
Tammy Bryant,udit.jain+MIStest@solarsales.in,19/02/25,202660,"Choco Sauce, Strawberry Crush, Kiwi Crush",
Brenda Lowe,udit.jain+MIStest@solarsales.in,17/04/25,120455,"Choco Sauce, Mint Mojito, Strawberry Crush",
Brooke Byrd,udit.jain+MIStest@solarsales.in,08-03-25,87641,"Choco Sauce, Mango Crush, Blueberry Syrup",
Lisa Estrada,udit.jain+MIStest@solarsales.in,13/06/25,90792,"Watermelon Syrup, Chocolate Frappe, Vanilla Frappe",
Amy Johnson,udit.jain+MIStest@solarsales.in,07-05-25,153447,"Watermelon Syrup, Mint Mojito, Lemon Juice",
Craig Oliver,udit.jain+MIStest@solarsales.in,03-05-25,50594,"Mint Mojito, Soda Base, Vanilla Frappe",
Travis Boone,udit.jain+MIStest@solarsales.in,29/05/25,69302,"Mint Mojito, Vanilla Frappe, Watermelon Syrup",
Kristine Roberts,udit.jain+MIStest@solarsales.in,18/02/25,76332,"Blueberry Syrup, Choco Sauce, Cola Base",
Timothy Brown,udit.jain+MIStest@solarsales.in,24/01/25,164856,"Watermelon Syrup, Orange Crush, Chocolate Frappe",
Alejandra Smith,udit.jain+MIStest@solarsales.in,04-04-25,97077,"Lemon Juice, Mint Mojito, Soda Base",
Peter Ewing,udit.jain+MIStest@solarsales.in,08-02-25,208275,"Lime Juice, Mango Crush, Cola Base",
Allison Garcia,udit.jain+MIStest@solarsales.in,25/05/25,148453,"Vanilla Frappe, Choco Sauce, Mango Crush",
Kimberly Roth DVM,udit.jain+MIStest@solarsales.in,18/05/25,58017,"Orange Crush, Choco Sauce, Cola Base",
Morgan Roth,udit.jain+MIStest@solarsales.in,05-02-25,175652,"Cola Base, Soda Base, Lime Juice",
